{
  "$schema": "https://sewellstephens.github.io/late/schema.json",
  "style": "default",
  "rsc": true,
  "tailwind": {
    "config": "tailwind.config.js",
    "css": "src/styles/globals.css",
    "baseColor": "slate",
    "cssVariables": true
  },
  "aliases": {
    "components": "@/components"
  }
}
